image_name,question,answer,question_type
synpic17848.jpg,Where is/are the nodules located?,Bilateral lungs,POS
synpic17693.jpg,What are the lesions indicative of?,Adenopathy,OTHER
synpic17693.jpg,What are the lesions consistent with?,Infection,OTHER
synpic17693.jpg,Where are the lesions located?,Paratracheal area,POS
synpic17693.jpg,Where is/are the lesions located?,Paratracheal area,POS
synpic17693.jpg,Where are the lesions?,Paratracheal area,POS
synpic17693.jpg,Where is/are the lesions located?,Paratracheal area,POS
synpic31394.jpg,How would you describe the pathology seen in the above image?,"Rounded, well-defined pulmonary nodules varying in size and pattern",ATTRIB
synpic31394.jpg,How would you describe the pathology in this image?,"Rounded, well-defined pulmonary nodules varying in size and pattern",ATTRIB
synpic31394.jpg,What is the pathology seen in this image?,pulmonary nodules,ABN
synpic17145.jpg,What is the pathology seen above?,bilateral pleural effusion,ABN
synpic17145.jpg,What is abnormal in this image?,bilateral pleural effusion,ABN
synpic17145.jpg,What abnormality is seen in this image?,bilateral pleural effusion,ABN
synpic17145.jpg,What is abnormal in this image?,bilateral pleural effusion,ABN
synpic27277.jpg,What organ system is shown in the above image?,cardiopulmonary,ORGAN
synpic27277.jpg,The image shows what organ system?,cardiopulmonary,ORGAN
synpic27277.jpg,In what position was the patient in when this image was taken?,Semi-upright position,OTHER
synpic27277.jpg,What position is the patient in for this image?,Semi-upright position,OTHER
synpic17675.jpg,What indicates there is no pleural effusion present?,Sharp costophrenic angles,PRES
synpic17675.jpg,What sign determines the absence of a pleural effusion?,Sharp costophrenic angles,PRES
synpic26413.jpg,What indicates there is a consolidation in the right lung?,"blunting of the costophrenic angle, loss of the right hemidiaphragm and right heart border",OTHER
synpic26413.jpg,What is the observed sign of pulmonary consolidation on the right side?,"blunting of the costophrenic angle, loss of the right hemidiaphragm and right heart border",OTHER
synpic18250.jpg,Name one abnormality in the radiograph.,Increased opacity in the left retrocardiac region,ABN
synpic18250.jpg,What is abnormal in this image?,Increased opacity in the left retrocardiac region,ABN
synpic18250.jpg,What is one abnormality that can be seen in the image?,Increased opacity in the left retrocardiac region,ABN
synpic18250.jpg,What is abnormal in this image?,Increased opacity in the left retrocardiac region,ABN
synpic32081.jpg,What is the abnormality?,Right paratracheal mass lesion,ABN
synpic32081.jpg,What is abnormal in this image?,Right paratracheal mass lesion,ABN
synpic32081.jpg,What is wrong in this image?,Right paratracheal mass lesion,ABN
synpic32081.jpg,What is abnormal in this image?,Right paratracheal mass lesion,ABN
synpic28987.jpg,What is wrong with the aortic area?,It is enlarged with prominence of the aortic knob,ABN
synpic28987.jpg,What is/are wrong with the aorta ?,It is enlarged with prominence of the aortic knob,ABN
synpic28987.jpg,What pathology is shown in the aorta?,It is enlarged with prominence of the aortic knob,ABN
synpic28987.jpg,What is/are wrong with the aorta ?,It is enlarged with prominence of the aortic knob,ABN
synpic53228.jpg,How many ribs are superimposed on the lung fields?,12,COUNT
synpic53228.jpg,How many ribs are there?,12,COUNT
synpic53228.jpg,How many ribs are present in vertical order on this chest radiograph,12,COUNT
synpic53228.jpg,How many ribs are there?,12,COUNT

